{
  "schema_version": 1,
  "term": "LEAP framework",
  "plain_definition": "The Hong Kong Government's name for its four-part digital-asset policy agenda: Legal and regulatory streamlining, Expanding tokenised products, Advancing use cases and cross-sectoral collaboration, and People and partnership development.",
  "formal_definition": "The organising framework of Policy Statement 2.0 on the Development of Digital Assets in Hong Kong, issued 26 June 2025.",
  "related_terms": ["Policy Statement 2.0", "tokenisation"],
  "first_used_card_id": "27a1b68218a47eb6ece2072efeb0b80cc05eb1c914f6b7a4a826b4f52287c903"
}
